[
  {
    "schemaVersion": 1,
    "ingredientId": "ing_salmon",
    "origin": "base",
    "currentRevisionId": "ingrev_salmon_raw_v2_p4",
    "status": "active",
    "createdAt": "2026-09-03T00:00:00Z",
    "updatedAt": "2026-09-03T14:04:00Z"
  },
  {
    "schemaVersion": 1,
    "ingredientId": "ing_rice_cooked",
    "origin": "base",
    "currentRevisionId": "ingrev_rice_cooked_v2_p4",
    "status": "active",
    "createdAt": "2026-09-03T00:00:00Z",
    "updatedAt": "2026-09-03T14:04:00Z"
  },
  {
    "schemaVersion": 1,
    "ingredientId": "ing_zucchini",
    "origin": "base",
    "currentRevisionId": "ingrev_zucchini_raw_v2_p4",
    "status": "active",
    "createdAt": "2026-09-03T00:00:00Z",
    "updatedAt": "2026-09-03T14:04:00Z"
  },
  {
    "schemaVersion": 1,
    "ingredientId": "ing_olive_oil",
    "origin": "base",
    "currentRevisionId": "ingrev_olive_oil_v2_p4",
    "status": "active",
    "createdAt": "2026-09-03T00:00:00Z",
    "updatedAt": "2026-09-03T14:04:00Z"
  }
]
